<?xml version="1.0" encoding="UTF-8"?>
<bank xmlns="http://bank-app.com"
      xmlns:xsi="http://www.w3.org/2001/XMLSchema-instance"
      xsi:schemaLocation="http://bank-app.com input.xsd">

    <account>
        <name>PUMB</name>
        <id>0000000001</id>
        <depositor>Bohdan Bondarenko</depositor>
        <country>Ukraine</country>
        <valet>
            <type>RECURRING_DEPOSIT_VALET</type>
            <amount>1204</amount>
            <currency>USD</currency>
            <annualPercentage>14</annualPercentage>
            <depositTerm>2020-11-30T12:00:00</depositTerm>
        </valet>
        <valet>
            <type>FIXED_DEPOSIT_VALET</type>
            <amount>544</amount>
            <currency>EUR</currency>
            <annualPercentage>10</annualPercentage>
            <depositTerm>2032-05-06T09:00:00</depositTerm>
        </valet>
        <valet>
            <type>FIXED_DEPOSIT_VALET</type>
            <amount>13643</amount>
            <currency>XCD</currency>
            <annualPercentage>20</annualPercentage>
            <depositTerm>2026-01-03T18:30:00</depositTerm>
        </valet>
    </account>

    <account>
        <name>Alpha Bank</name>
        <id>0000000003</id>
        <depositor>Dmitry Kolesnikov</depositor>
        <country>China</country>
    </account>

    <account>
        <name>OTP Bank</name>
        <id>0000000000</id>
        <depositor>Bohdan Boiko</depositor>
        <country>Ukraine</country>
        <valet>
            <type>CURRENT_DEPOSIT_VALET</type>
            <amount>54</amount>
            <currency>UAH</currency>
            <annualPercentage>5</annualPercentage>
            <depositTerm>2002-05-30T09:00:00</depositTerm>
        </valet>
    </account>
</bank>